{"generated_at":"2026-08-12T00:00:00Z","kind":"hero_window","params":{},"rows":[{"avg_opponent_rating":800.8,"ghost":{"battles":347247,"win_rate":0.3586},"hero":"Dooley","matchups":[{"decided":24523,"losses":9086,"opponent_hero":"Pygmalien","win_rate":0.6295,"wins":15437},{"decided":24491,"losses":10483,"opponent_hero":"TheDragons","win_rate":0.572,"wins":14008},{"decided":24337,"losses":9305,"opponent_hero":"Vanessa","win_rate":0.6177,"wins":15032},{"decided":23991,"losses":9120,"opponent_hero":"Dooley","win_rate":0.6199,"wins":14871},{"decided":23642,"losses":9061,"opponent_hero":"Mak","win_rate":0.6167,"wins":14581},{"decided":21780,"losses":8615,"opponent_hero":"Karnok","win_rate":0.6045,"wins":13165},{"decided":17100,"losses":6332,"opponent_hero":"Jules","win_rate":0.6297,"wins":10768},{"decided":16377,"losses":6752,"opponent_hero":"Stelle","win_rate":0.5877,"wins":9625}],"opponent_ranks":[{"decided":56238,"rank":"Bronze","share":0.3191,"win_rate":0.6435},{"decided":36731,"rank":"Silver","share":0.2084,"win_rate":0.6356},{"decided":68183,"rank":"Gold","share":0.3869,"win_rate":0.5824},{"decided":13113,"rank":"Diamond","share":0.0744,"win_rate":0.5502},{"decided":1976,"rank":"Legendary","share":0.0112,"win_rate":0.5172}],"performance_rating":878.4,"rank_runs":[{"rank":"Bronze","runs":1846},{"rank":"Silver","runs":1519},{"rank":"Gold","runs":6181},{"rank":"Diamond","runs":4286},{"rank":"Legendary","runs":2297}],"rating":{"max":1056,"mean":810.0,"min":667,"p10":800.0,"p50":800.0,"p90":821.0,"runs":16129,"stddev":35.5},"rating_delta":{"net":4,"runs":16129},"runs":{"completed":16129,"results":{"flawless":450,"ten_win":4757,"wins_0_3":3098,"wins_4_6":3807,"wins_7_9":4017}},"segment":"all","ten_win":{"avg_final_days":12.5,"runs":5207},"win_rate":0.6099},{"avg_opponent_rating":800.8,"ghost":{"battles":245275,"win_rate":0.3492},"hero":"Jules","matchups":[{"decided":6139,"losses":2444,"opponent_hero":"Vanessa","win_rate":0.6019,"wins":3695},{"decided":6064,"losses":2052,"opponent_hero":"Pygmalien","win_rate":0.6616,"wins":4012},{"decided":6029,"losses":2746,"opponent_hero":"TheDragons","win_rate":0.5445,"wins":3283},{"decided":5962,"losses":2378,"opponent_hero":"Dooley","win_rate":0.6011,"wins":3584},{"decided":5927,"losses":2322,"opponent_hero":"Mak","win_rate":0.6082,"wins":3605},{"decided":5517,"losses":2107,"opponent_hero":"Karnok","win_rate":0.6181,"wins":3410},{"decided":4309,"losses":1652,"opponent_hero":"Jules","win_rate":0.6166,"wins":2657},{"decided":4292,"losses":1890,"opponent_hero":"Stelle","win_rate":0.5596,"wins":2402}],"opponent_ranks":[{"decided":13311,"rank":"Bronze","share":0.3009,"win_rate":0.6498},{"decided":9409,"rank":"Silver","share":0.2127,"win_rate":0.6375},{"decided":17778,"rank":"Gold","share":0.4019,"win_rate":0.5631},{"decided":3236,"rank":"Diamond","share":0.0731,"win_rate":0.5426},{"decided":505,"rank":"Legendary","share":0.0114,"win_rate":0.4614}],"performance_rating":873.0,"rank_runs":[{"rank":"Bronze","runs":353},{"rank":"Silver","runs":342},{"rank":"Gold","runs":1775},{"rank":"Diamond","runs":1102},{"rank":"Legendary","runs":576}],"rating":{"max":1051,"mean":808.8,"min":562,"p10":800.0,"p50":800.0,"p90":819.0,"runs":4148,"stddev":34.1},"rating_delta":{"net":0,"runs":4148},"runs":{"completed":4148,"results":{"flawless":93,"ten_win":1191,"wins_0_3":900,"wins_4_6":1043,"wins_7_9":921}},"segment":"all","ten_win":{"avg_final_days":12.7,"runs":1284},"win_rate":0.6024},{"avg_opponent_rating":800.9,"ghost":{"battles":309625,"win_rate":0.368},"hero":"Karnok","matchups":[{"decided":16586,"losses":6293,"opponent_hero":"Vanessa","win_rate":0.6206,"wins":10293},{"decided":16405,"losses":7131,"opponent_hero":"TheDragons","win_rate":0.5653,"wins":9274},{"decided":16242,"losses":6328,"opponent_hero":"Pygmalien","win_rate":0.6104,"wins":9914},{"decided":16176,"losses":6050,"opponent_hero":"Dooley","win_rate":0.626,"wins":10126},{"decided":15957,"losses":6071,"opponent_hero":"Mak","win_rate":0.6195,"wins":9886},{"decided":14934,"losses":5953,"opponent_hero":"Karnok","win_rate":0.6014,"wins":8981},{"decided":11515,"losses":4404,"opponent_hero":"Jules","win_rate":0.6175,"wins":7111},{"decided":11232,"losses":4712,"opponent_hero":"Stelle","win_rate":0.5805,"wins":6520}],"opponent_ranks":[{"decided":33842,"rank":"Bronze","share":0.2843,"win_rate":0.6636},{"decided":26021,"rank":"Silver","share":0.2186,"win_rate":0.6315},{"decided":48979,"rank":"Gold","share":0.4114,"win_rate":0.5653},{"decided":8701,"rank":"Diamond","share":0.0731,"win_rate":0.5448},{"decided":1504,"rank":"Legendary","share":0.0126,"win_rate":0.5233}],"performance_rating":875.4,"rank_runs":[{"rank":"Bronze","runs":592},{"rank":"Silver","runs":951},{"rank":"Gold","runs":4929},{"rank":"Diamond","runs":2861},{"rank":"Legendary","runs":1559}],"rating":{"max":1076,"mean":810.4,"min":571,"p10":800.0,"p50":800.0,"p90":817.0,"runs":10892,"stddev":38.8},"rating_delta":{"net":0,"runs":10892},"runs":{"completed":10892,"results":{"flawless":293,"ten_win":3018,"wins_0_3":2061,"wins_4_6":2690,"wins_7_9":2830}},"segment":"all","ten_win":{"avg_final_days":12.6,"runs":3311},"win_rate":0.6057},{"avg_opponent_rating":801.0,"ghost":{"battles":347312,"win_rate":0.3484},"hero":"Mak","matchups":[{"decided":26644,"losses":9964,"opponent_hero":"Pygmalien","win_rate":0.626,"wins":16680},{"decided":26129,"losses":9912,"opponent_hero":"Vanessa","win_rate":0.6207,"wins":16217},{"decided":26079,"losses":11542,"opponent_hero":"TheDragons","win_rate":0.5574,"wins":14537},{"decided":25850,"losses":9684,"opponent_hero":"Dooley","win_rate":0.6254,"wins":16166},{"decided":25460,"losses":9221,"opponent_hero":"Mak","win_rate":0.6378,"wins":16239},{"decided":23690,"losses":9287,"opponent_hero":"Karnok","win_rate":0.608,"wins":14403},{"decided":18255,"losses":6751,"opponent_hero":"Jules","win_rate":0.6302,"wins":11504},{"decided":18073,"losses":7758,"opponent_hero":"Stelle","win_rate":0.5707,"wins":10315}],"opponent_ranks":[{"decided":51014,"rank":"Bronze","share":0.2682,"win_rate":0.6723},{"decided":40295,"rank":"Silver","share":0.2119,"win_rate":0.6413},{"decided":79465,"rank":"Gold","share":0.4178,"win_rate":0.5733},{"decided":16640,"rank":"Diamond","share":0.0875,"win_rate":0.54},{"decided":2766,"rank":"Legendary","share":0.0145,"win_rate":0.4971}],"performance_rating":878.9,"rank_runs":[{"rank":"Bronze","runs":845},{"rank":"Silver","runs":1177},{"rank":"Gold","runs":6667},{"rank":"Diamond","runs":5334},{"rank":"Legendary","runs":3337}],"rating":{"max":1070,"mean":813.2,"min":578,"p10":800.0,"p50":800.0,"p90":853.0,"runs":17360,"stddev":40.6},"rating_delta":{"net":29,"runs":17360},"runs":{"completed":17360,"results":{"flawless":397,"ten_win":5718,"wins_0_3":3444,"wins_4_6":4064,"wins_7_9":3737}},"segment":"all","ten_win":{"avg_final_days":12.8,"runs":6115},"win_rate":0.6103},{"avg_opponent_rating":800.6,"ghost":{"battles":352959,"win_rate":0.3502},"hero":"Pygmalien","matchups":[{"decided":30907,"losses":14956,"opponent_hero":"TheDragons","win_rate":0.5161,"wins":15951},{"decided":30756,"losses":13280,"opponent_hero":"Pygmalien","win_rate":0.5682,"wins":17476},{"decided":30728,"losses":12872,"opponent_hero":"Vanessa","win_rate":0.5811,"wins":17856},{"decided":30122,"losses":13206,"opponent_hero":"Dooley","win_rate":0.5616,"wins":16916},{"decided":30088,"losses":12738,"opponent_hero":"Mak","win_rate":0.5766,"wins":17350},{"decided":27352,"losses":11877,"opponent_hero":"Karnok","win_rate":0.5658,"wins":15475},{"decided":21433,"losses":9931,"opponent_hero":"Jules","win_rate":0.5366,"wins":11502},{"decided":21079,"losses":9302,"opponent_hero":"Stelle","win_rate":0.5587,"wins":11777}],"opponent_ranks":[{"decided":67234,"rank":"Bronze","share":0.3022,"win_rate":0.5967},{"decided":47985,"rank":"Silver","share":0.2157,"win_rate":0.5816},{"decided":89239,"rank":"Gold","share":0.4011,"win_rate":0.5293},{"decided":16042,"rank":"Diamond","share":0.0721,"win_rate":0.5052},{"decided":1965,"rank":"Legendary","share":0.0088,"win_rate":0.4768}],"performance_rating":841.6,"rank_runs":[{"rank":"Bronze","runs":1909},{"rank":"Silver","runs":2101},{"rank":"Gold","runs":9054},{"rank":"Diamond","runs":5832},{"rank":"Legendary","runs":2264}],"rating":{"max":1056,"mean":804.8,"min":163,"p10":800.0,"p50":800.0,"p90":800.0,"runs":21160,"stddev":24.9},"rating_delta":{"net":0,"runs":21160},"runs":{"completed":21160,"results":{"flawless":280,"ten_win":5797,"wins_0_3":6181,"wins_4_6":5158,"wins_7_9":3744}},"segment":"all","ten_win":{"avg_final_days":13.2,"runs":6077},"win_rate":0.5588},{"avg_opponent_rating":801.1,"ghost":{"battles":243073,"win_rate":0.3948},"hero":"Stelle","matchups":[{"decided":11819,"losses":4162,"opponent_hero":"Vanessa","win_rate":0.6479,"wins":7657},{"decided":11717,"losses":4602,"opponent_hero":"TheDragons","win_rate":0.6072,"wins":7115},{"decided":11654,"losses":3983,"opponent_hero":"Dooley","win_rate":0.6582,"wins":7671},{"decided":11618,"losses":4138,"opponent_hero":"Pygmalien","win_rate":0.6438,"wins":7480},{"decided":11444,"losses":4077,"opponent_hero":"Mak","win_rate":0.6437,"wins":7367},{"decided":10273,"losses":3691,"opponent_hero":"Karnok","win_rate":0.6407,"wins":6582},{"decided":8130,"losses":3143,"opponent_hero":"Stelle","win_rate":0.6134,"wins":4987},{"decided":8086,"losses":2757,"opponent_hero":"Jules","win_rate":0.659,"wins":5329}],"opponent_ranks":[{"decided":21624,"rank":"Bronze","share":0.2552,"win_rate":0.7027},{"decided":17911,"rank":"Silver","share":0.2114,"win_rate":0.6682},{"decided":35964,"rank":"Gold","share":0.4244,"win_rate":0.6076},{"decided":7751,"rank":"Diamond","share":0.0915,"win_rate":0.566},{"decided":1491,"rank":"Legendary","share":0.0176,"win_rate":0.5272}],"performance_rating":900.7,"rank_runs":[{"rank":"Bronze","runs":281},{"rank":"Silver","runs":502},{"rank":"Gold","runs":2695},{"rank":"Diamond","runs":2264},{"rank":"Legendary","runs":1856}],"rating":{"max":1061,"mean":821.1,"min":546,"p10":800.0,"p50":800.0,"p90":893.0,"runs":7598,"stddev